Singer	Title	Actual lyrics	text	
Atif Aslam	Tere Sang Yaara	"Tere sang yaara
Khush rang bahara
Tu raat deewani
Main zard sitara
 
O karam khudaya hai
Tujhe mujhse milaya hai
Tujhpe marke hi toh
Mujhe jeena aaya hai
 
O tere sang yaara
Khushrang bahara
Tu raat deewani
Main zard sitara
 
O tere sang yaara
Khushrang bahara
Main tera ho jaun
Jo tu karde ishara
 
Kahi kisi bhi gali mein jaaun main
Teri khushbu se takraun main
Har raat jo aata hai mujhe
Woh khwab tu..
 
Tera mera milna dastoor hai
Tere hone se mujhme noor hai
Main hoon soona sa ek aasmaan
Mehtaab tu..
 
O karam khudaya hai
Tujhe maine jo paaya hai
Tujhpe marke hi toh
Mujhe jeena aaya hai
 
O tere sang yaara
Khush rang bahara
Tu raat deewani
Main zard sitara
 
O tere sang yara
Khush rang bahara
Tere bin ab toh
Na jeena ganvara
 
Maine chhode hai baki saare rastein
Bas aaya hun tere paas re
Meri ankhon me tera naam hai
Pehchaan le..
 
Sab kuch mere liye tere baad hai
Sau baaton ki ik baat hai
Main na jaunga kabhi tujhe chhod ke
Yeh jaane le..
 
O karam khudaya hai
Tera pyaar jo paaya hai
Tujhpe marke hi toh
Mujhe jeena aaya hai
 
O tere sang yaara
Khush rang bahara
Tu raat deewani
Main zard sitara
 
O tere sang yaara
Khush rang bahara
Main behta musafir
Tu tehra kinara"	"With you my love
It's like a colorful spring
You are like a mad night
I'm like a yellow star
 
It's a blessing of God
That he let us meet
After madly falling in love with you,
I have learned how to live
 
With you my love
It's like a colorful spring
You are like a mad night
I'm like a yellow star
 
With you my love
It's like a colorful spring
I will be yours
If you give me one tiny signal
 
Whichever street I wander inside
I come face to face with your scent
Every night
You're the dream that I see
 
You and me meeting here, is like a rule
I'm enlightened for I'm yours
I'm like a quiet sky
and you're the moon
 
It's a blessing of God
That he let us meet
After madly falling in love with you,
I have learned how to live
 
With you my love
It's like a colorful spring
You are like a mad night
I'm like a yellow star
 
With you my love
It's like a colorful spring
Without you,
I don't wanna live
 
I have left behind all the roads
And came to you
The tears in my eyes are yours
Recognize them
 
For me everything is second to you
This sentence of mine is worth a hundred normal sentences of mine
I will never leave you
Know that!
 
It's a blessing of God
That he let us meet
After madly falling in love with you,
I have learned how to live
 
With you my love
It's like a colorful spring
You are like a mad night
I'm like a yellow star
 
With you my love
It's like a colorful spring
I'm a drowning traveler
And you're the dry coastline"	4
Atif Aslam	Teri Yaadein Mulakatein	"Teri yaaden...
 
Mulakaten...
 
Main kaise bhuloon chahat ki wo barsaaten
 
Teri yaaden...
 
Mulakaten...
 
Main kaise bhuloon chahat ki wo barsaaten
 
Tu hi mera dil hai
Tu hi meri jaaaan
 
Tu hi mera dil hai
Tu hi meri jaaaan...
 
Kabhi to paas mere aao
Kabhi to nazren mujhse milao
Kabhi to dil se dil ko milao
oh jaaaanaaa.....
 
Meri jaan palken yun na jhukana
Meri jaan mujhse dooor na jana
Meri jaan mujh ko bhul na jana
 
oh jaaaanaaaaa........
 
Mujhe lauta de
Wo mera pyaar...
 
Mujhe lauta de
Wo mera pyaar...
 
Main tera hi deewana hun
Teri baaten kabhi main bhul na paaun
 
Main tera hi deewana hun
Teri baaten kabhi main bhul na paaun
 
Tu hi mera dil hai
Tu hi meri jaaaan
 
Tu hi mera dil hai
Tu hi meri jaaaan...
 
oh yaara...
kyun khafa ho mujhse
 
oh yaraa...
kyun juda ho mujhse
 
oh yaara...
Mera pyar hai tujhse
 
oh jaaanaaaaa......
 
Tere bin dil-lagi hai adhoori
 
Terebin ashiqui hai adhoori
 
Mujhe milna hai tujhse zaroori
 
oh jaaanaaa....
 
Mujhe lauta de
Wo mera pyaar...
 
Mujhe lauta de
Wo mera pyaar...
 
Kabhi to paas mere aao
Kabhi to nazren mujhse milao
Kabhi to dil se dil ko milao
oh jaaaanaaa.....
 
Meri jaan palken yun na jhukana
Meri jaan mujhse dooor na jana
Meri jaan mujh ko bhul na jana
 
oh jaaaanaaaaa........
 
Tu hi mera dil hai
Tu hi meri jaaaan
 
Tu hi mera dil hai
Tu hi meri jaaaan..."	"Your memories...
 
Events of meet..
 
How can I forget those showering of love...
 
Your memories...
 
How can I forget those showering of love...
 
It you're my heart
and you're my life
 
It you're my heart
and you're my life..
 
At time or else come nigh to me
At time or else do connect the eyes to me
And at time or else get the heart stuck to the heart.
(hark) Soul hair....
 
My life do not being lower the wink
My life do not do away from me
And my life do not forget me
 
(hark) soul hair....
 
Give me back
that my love...
 
Give me back
that my love...
 
I'm yours insane
Your pieces of talk I could never forget
 
I'm yours insane
Your pieces of talk I could never forget
 
It you're my heart
and you're my life..
 
It you're my heart
and you're my life..
 
(hark) partner...
Why do be disappoint of me
 
(hark) partner...
Why do be apart from me
 
(hark) partner...
My love is for you
 
(hark) soul hair....
 
Without you under-complete the joy
 
Without you under-complete the romance
 
It is necessary to meet of you
 
(hark) soul hair....
 
Give me back
that my love...
 
Give me back
that my love...
 
At time or else come nigh to me
At time or else do connect the eyes to me
And at time or else get the heart stuck to the heart.
(hark) Soul hair....
 
At time or else come nigh to me
At time or else do connect the eyes to me
And at time or else get the heart stuck to the heart.
 
(hark) Soul hair....
 
My life do not being lower the wink
My life do not do away from me
And my life do not forget me
 
(hark) Soul hair....
 
It you're my heart
and you're my life..
 
It you're my heart
and you're my life.."	
Atif Aslam	Woh Lamhe	"Woh Lamhe, woh baatein,
Koi na jaane,
Thi kaisi raatein,
Hooo, barsaatein,
Woh bheegi bheegi yaadein,
Woh bheegi bheegi yaadein...
 
Na main jaanoun, Na tu jaane,
 
(aaah)
Kaisa hai ye mausam,
Koi na jaane,
Kahi se hai fizaa aayi,
Ghamon ki dhoop sang laayi,
Khafaa hogaye hum,
Judaa hogaye hum,
 
Who Lamhe, who baatein,
Koi na jaane,
Thi kaisi raatein,
Hooo, barsaatein,
Who bheegi bheegi yaadein,
Who bheegi bheegi yaadein...
 
(hoooo...)
 
Saagar ki, Gehraayi se,Gehra hai, Apna pyaar,
Sehraoun ki, In hawaon me, Kaise aayeee-gi bahaar,
Kahan se ye hawa aayi,
Ghataayen kaali kyoun chhaayi,
Khafaa hogaye hum,
Judaa hogaye hum,
 
Woh Lamhe, woh baatein,
Koi na jaane,
Thi kaisi raatein,
Hooo, barsaatein,
Who bheegi bheegi yaadein,
Who bheegi bheegi yaadein"	"Those moments, those talks
no one kno
how were those nights
those rain showers
those damp memories
those damp memories
 
neither I know, nor do you know
 
(aaah)
how is this weather
no one knows
from where has this breeze come
she has brought sunshine of sorrow with her
I have become angry
we have become separated
 
Those moments, those talks
no one knows
how were those nights
those rain showers
those damp memories
those damp memories
 
(hoooo...)
 
our love is deeper than the depths of the ocean
how is the spring going to come in the winds of trembling fear
from where has this wind come
why have the black clouds over shadowed the sky
 
Those moments, those talks
no one knows
how were those nights
those rain showers
those damp memories
those damp memories"	2
Atif Aslam	Tu Jane Na	"Kaise Bataaye Kyun Tujhko Chaahe
Yaara Bata Na Paaye
Baatein Dilon Ki Dekho Jo Baaki
Aankhein Tujhe Samjhaaye
Tu Jaane Na Aaa
Tu Jaane Na
Tu Jaane Na Aaa
Tu Jaane Na

Milake Bhi Hum Na Mile
Tumse Na Jaane Kyun
Milon Ke Hai Faasle
Tumse Na Jaane Kyun
Anjaane Hai Silsile
Tumse Na Jaane Kyun
Sapne Hai Palakon Tale
Tumse Na Jaane Kyun

Kaise Bataaye Kyun Tujhko Chaahe
Yaara Bata Na Paaye
Baatein Dilon Ki Dekho Jo Baaki
Aankhein Tujhe Samjhaaye
Tu Jaane Na Aaa
Tu Jaane Na
Tu Jaane Na Aaa
Tu Jaane Na

Nigaahon Mein Dekho Meri
Jo Hai Bas Gaya
Woh Hai Milata Tumse Hubahu
O O O Jaane Teri Aankhein Thi Ya
Baatein Thi Wajah
Huye Tum Jo Dil Ki Aarzoo
Tum Paas Hoke Bhi
Tum Aas Hoke Bhi
Ehsaas Hoke Bhi
Apne Nahi Aise Hai
Humko Gile Tumse Na Jaane Kyun
Milon Ke Hai Faasle
Tumse Na Jaane Kyun
Tu Jaane Na Aaa
Tu Jaane Na
Tu Jaane Na Aaa
Tu Jaane Na

Ooo Jaane Na Jaane Na Jaane Na... aaaaaaaaa aaa
Tu Jaane Na

Khayalon Mein Lakhon Baatein Yun Toh Keh Gayaaaa
Bola Kuch Na Tere Samne
Oooo Hue Na Begaane Bhi Tum Hoke Aur Ke
Dekho Tum Na Mere Hi Bane
Afsos Hota Hai Dil Bhi Yeh Rota Hai
Sapne Sanjota Hai Pagla Hua Soche Yeh
Hum The Mile Tumse Na Jaane Kyun

Meelon Ke Hai Faasle Tumse Na Jaane Kyun
Anjaane Hai Silsale Tumse Na Jaane Kyun
Sapne Hai Palko Tale Tumse Na Jaane Kyun

Hooooooohh

Kaise Bataaye Kyun Tujhko Chaahe
Yaara Bata Na Paaye
Baatein Dilon Ki Dekho Jo Baaki
Aankhein Tujhe Samjhaaye
Tu Jaane Na, Tu Jaane Na
Tu Jaane Na, Tu Jaane Na"	"how should i tell you that why i am loving you
o beloved, i am not able to tell you
the talks of my heart, my eyes are explaining to you
you didn't know it, you are not knowing
even after meeting we didn't meet
with you don't know why there is distance of miles
with you don't know why there is a strange chain
for you i don't know why i have dreams
with you i don't know
how should i tell you that why i am loving you
o beloved, i am not able to tell you
the talks of my heart, my eyes are explaining to you
but you didn't know it, you are not knowing
the one who resides in my eyes
matches with you completely
were it your eyes or your talks
which became desire of my heart
even though you are near to me, even though you are my desire
even though there are feelings, you are not my, this is the state
i have complain that don't know why i have distances of miles with you
you don't know
you don't know, you don't know, you don't know, you don't know
dont know, dont know, dont know, dont know
you don't know
in my thoughts i have said lacs of things
but didn't say anything in front of you
becoming somebody else’s, you didn't become strange to me
see that you didn't became my only
i feel regretted, my heart also cries
it is decorating dreams, it has become mad and thinking
that we were met, don't know why there are distance of miles with you
with you don't know why there is a strange chain
for you i don't know why i have dreams
don't know why with you
how should i tell you that why i am loving you
o beloved, i am not able to tell you
the talks of my heart my eyes are explaining to you
but you didn't know it, you are not knowing"	2
Atif Aslam	Allah Duhai Hai	"Har ghadi har paher mujhe
Bas khayal hai ab tera
Kaise katenge din tere bin
Yahi bas sawaal hai ab mera...
 
We are coming back to the race
Yeah I'm coming back to the race
Tell me if you ready!
Can you take the pace?
This time wanna make you see
Ain't nobody gonna play game like me
Undercover call I eyes... yeah
You know, You know
You loose when you fall the dice
Just gonna chew and make you see
Make you see...
Ain't nobody gonna run a race like me
 
Ek baar nahi yeh dil sau baar hai toota
Par shauq mohabbat ka ab tak na choota
Ek baar nahi yeh dil sau baar hai toota
Par shauq mohabbat ka ab tak na choota
 
Muskurate huey chehre
Chhupaye hain raaz gehre
Yahaan toh har chehra hai jhootha
 
Allah duhai hai
Allah duhai hai, phir bewafaai hai
Mushqil rihaai hai, haan tere pyar mein
Allah duhai hai, phir bewafaai hai
Mushqil rihaai hai, haan tere pyar mein
Haan tere pyar mein
 
(You can't escape my love...)
 
Haan hai khata meri mila jo bhi
Yahi poochhe: wafaa kyun ki?
Wafaa kyun ki?
Wafa toh hoti kahaan aajkal hai kahin par bhi
Ishq me jo agar pal do gujar jaayein
Toh phir saari umar kya hai
Maane naa maane koi baat
Maano ki jeene ka yeh matlab hai
Ishq hi ek mazhab hai
Ishq naa ho toh Rab hai rootha
 
Allah duhai hai, phir bewafaai hai
Mushqil rihaai hai haan tere pyar mein
Allah duhai hai, phir bewafaai hai
Mushqil rihaai hai haan tere pyar mein
 
Haan hai zamaane se tu beparwaah
Main beparwaah to phir kaisa koi parda
Haan koi parda jo hota toh dil kya fida hota
Ishq naa ho duaayen ki
Ishq ho to duaayen ki, sazaayein li
Maane na tauba hai kaisi balaa hai, ki is dil ko
Bada roka chala khaane hai phir dhokha
Yeh dil apni fitrat se toota
 
Allah duhai hai, phir bewafaai hai
Mushqil rihaai hai, haan tere pyaar mein
Allah duhai hai, phir bewafaai hai
Mushqil rihaai hai, haan tere pyaar mein
 
Yeah I'm coming back to the race
Tell me if you ready!
Can you take the pace?
This time wanna make you see
Ain't nobody gonna play game like me
Undercover call I eyes... yeah
You know, You know
You loose when you fall the dice
Just gonna chew and make you see
Make you see...
Ain't nobody gonna run a race like me"	"In every second every moment
I have the thought of You
How will the days go without You
That is my only question
 
We are coming back to the race
Yeah I'm coming back to the race
Tell me if you're ready!
Can you take the pace?
This time wanna make you see
Ain't nobody gonna play game like me
Undercover core like eyes... yeah
You know, You know
You loose when you call the die
Just gonna chew and make you see
Make you see...
Ain't nobody gonna run a race like me
 
Not just once, but this heart has been broken a hundred times
But the desire of love has not gone
Not just once, but this heart has been broken a hundred times
But the desire of love has not gone
 
These smiling faces
Are hiding dark secrets
Every face here is false
 
I complain to You God
I complain to You God, It's unfaithfulness again
It's difficult to get free, Yes in Your Love
I complain to You God, It's unfaithfulness again
It's difficult to get free, Yes in Your Love
Yes in Your Love
 
You can't escape my love...
 
Yes it is my fault that You got this
I ask only this: Why did You Love?
Why did You Love?
Where is Love nowadays anywhere
If we spend a few moments in Love now
Then what is the whole life worth
It doesn't listen to any talk
Just believe that Life has only one meaning
Love is the only religion
If there is no Love then even the God is angry
 
I complain to You God, It's unfaithfulness again
Its difficult to get free, Yes in Your Love
I complain to You God, It's unfaithfulness again
It's difficult to get free, Yes in Your Love
 
Yes You are regardless of the world
I am also regardless, then why any veil from me
Yes if there was a veil then would any heart fall for it
I prayed for love not to happen
I prayed for love to happen, I took punishment
I have understood that this is a huge burden
I tried to stop this heart a lot, but it going once again to get cheated
This heart is broken because of its own nature
 
I complain to You God, It's unfaithfulness again
It's difficult to get free, Yes in Your Love
I complain to You God, It's unfaithfulness again
It's difficult to get free, Yes in Your Love
 
Yeah I'm coming back to the race
Tell me if you're ready!
Can you take the pace?
This time wanna make you see
Ain't nobody gonna play game like me
Undercover core like eyes... yeah
You know, You know
You loose when you call the die
Just gonna chew and make you see
Make you see...
Ain't nobody gonna run a race like me"	
Atif Aslam	Be Intehaan	"Suno na kahe kya suno na
Dil mera suno na, suno zara
Teri baahon mein mujhe rehna hai raat bhar
Teri baahon mein hogi subah
 
Be-intehaan
Yoon pyaar kar be-intehaa
Dekha karoon saari umar
Tere nishaan be-intehan
Koi kasar naa rahe, meri khabar na rahe
Chhoo le mujhe is kadar be-intehaan
 
Jab saanson mein teri saansein ghuli toh
Phir sulagne lage
Ehsaas mere mujhse kehne lage
Haan baahon mein teri aa ke jahaan do
Yoon simatne lage
Sailaab jaise koi behne lage
Khoya hoon main aagosh mein
Tu bhi kahaan ab hosh mein
Makhmali raat ki ho naa subah
Be intehaan, be-intehaan
Yoon pyar kar be-inteha
 
Gustakhiyan kuch tum karo
Kuch hum karein is tarah
Sharma ke do saaye hain jo
Muh pher lein hum se yahaan
 
Haan chhoo to liya hai ye jism tune
Rooh bhi choom le
Alfaaz bheege bheege kyun hain mere
Haan yoon choor ho ke majboor ho ke
Qatra qatra kahe
Ehsaas bheege bheege kyun hain mere
Do bekhabar bheege badan
Ho besabar bheege badan
Le rahe raat bhar angdaiyaan
 
Be inteha, be inteha
Yoon pyaar kar, be inteha
Dekha karoon saari umar
Tere nishan, be-intehaan
Koi kasar na rahe, meri khabar na rahe
Chhoo le mujhe is kadar be-intehaan"	"Listen, what my heart says,
Listen, listen for a while..
I have to stay in your arms all night long..
The morning will be in your arms..
 
Limitless,
Love me without any limits..
I'd see, all my life,
your signs, limitless..
There should be nothing lacking, I should be out of consciousness,
Touch me so much, so much as without limits..
 
When your breaths got dissolved into mine,
feelings began to fire up again,
they began talking to me..
Coming into your arms,
Both my worlds
Began to contract.
I am lost in your arms,
you're not conscious either..
There be no morning to velvetty night,
Limitless...
Love me in such a way, without any limits..
 
Do some effrontery..
and some I do, in such a way,
that even the two shadows that we see here,
feel shy and turn their faces the other way..
 
You have touched this body
Now kiss my soul too..
Why are my words all drenched
Being all broken, being helpless,
every element says,
why are my feelings all drenched
Two unaware drenched bodies,
two impatient drenched bodies
are turning all night..
 
Limitless,
Love me without any limits..
I'd see, all my life,
your signs, limitless..
There should be nothing lacking, I should be out of consciousness,
Touch me so much, so much as without limits.."	
Atif Aslam	Jeene Laga hoon	"Jeene Laga Hoon Pehle Se Zyada
Pehle Se Zyada Tum Pe Marne Laga Hoon...

Main Mera Dil Aur Tum Ho Yahaan...
Phir Kyun Ho Palkein Jhukayein Wahan...
Tum Sa Haseen Maine Dekha Nahin...
Tum Isse Pehle The Jane Kahaan...

Jeene Laga Hoon Pehle Se Zyada
Pehle Se Zyada Tum Pe Marne Laga...

Rehte Ho Aake Jo Tum Paas Mere
Tham Jaaye Pal Ye Wahin, Bass Main Yeh Sochun...

[Female:] Sochu Main Tham Jaaye Pal Yeh Paas Mere Jab Ho Tum... [x2]

Chalti Hai Saansein Pehle Se Zyada
Pehle Se Zyada Dil Theharne Laga...

Tanhaiyon Mein Tujhe Dhoondhe Mera Dil
Har pal yeh tujhko hi soche bhala kyun

[Female: x2]
Tanhai Mein Dhoondhe Tujhe Dil
Har pal tujhko soche...

Milne lage dil, pehle se zyada. Pehle se zyada ishq hone laga..."	"I have started living more than beforee
I have started dying more for you than before
I, my heart and you are here
Then why are you there with leaning eyelids
I have not seen anyone before as beautiful as you
Where were you before this
I have started living more than beforee
I have started dying more for you than before
When you come and be with me
I just want those moments to stop there
I want those moments to stop there
When you are with me
The breathes become faster than before
The heart starts stopping more than before
My heart finds you when it feels lonely
Why does it think of you every moment
The heart finds you when it feels lonely
It thinks of you every moment
The hearts have started to meet more than before
The love has started to happen more than before"	1
Atif Aslam	Bakhuda Tumhi ho	"Tu hi ehsason mein
Tuhi jazbaton mein
Tu hi lamhaton mein
Tu hi din raaton mein

Bakhuda tumhi ho, har jagah tumhi ho
Haan mein dekhun jahan jub
Us jagah tumhi ho
Yeh jahan tumhi ho, woh jahan tumhi ho
Is zameen se falak ke darmiyan, tumhi ho
Tumhi ho beshumar, tumhi ho
Tumhi ho, mujh mein haan, tumhi ho,
Tumhi ho
Ho...

Kaise batayein tumhein, aur kis tarah yeh
Kitna tumhein hum chahte hain
Saaya bhi tera dikhe, to paas jaake
Usmein simat hum jaatay hain

Raasta tumhi ho, rehnuma tumhi ho,
Jiski khwahish hai humko, woh panah tumhi ho,
Tumhi ho, beshumaar, tumhi ho
Tumhi ho mujh mein haan, tumhi ho

Tum hi ehsason mein,
Tum hi jazbaton mein,
Tum hi lamhaton mein,
Tum hi din raaton mein...

Kaise batayein tumhein, shub mein tumhare
Khwab haseen jo aatay hain,
Kaise batayein tumhein, lamz woh saare,
Jism ko jo mehkate hain

Ifteda tumhi ho, inteha tumhi ho
Tum ho jine ka maksad
Aur wajah tumhi ho...

Bakhuda tumhi ho, har jagah tumhi ho
Haan mein dekhua jahan jab, us jagah tumhi ho

Yeh jahan tumhi ho, woh jahan tumhi ho
Iss zameen se falak ke, darmiyan tumhi ho

Tumhi ho, beshumar, tumhi ho
Tumhi ho, mujh mein haan, tumhi ho
Tumhi ho
Ho..."	"Only you are in my feelings Only you are in my emotions Ony you are in my moments Ony you are in my days and nights
I swear to God, you are the one You are at every place Yes, wherevever and whenever I look You are there
You are this world You are the other world You are between the earth and the sky You are the precious one 
You are the one Yes,you are in me 
How should I tell you and in which way That how much I love you Even if I see your shadow,I go near it And I shrink in it
You are the path You are the protector Which I desire You are that shelter
How should I tell you The beautiful dreams I have at night about you 
How should I tell you About your touch That brings fragnance to my body
You are the start You are the ending You are the aim of my life And you are the reason
"	
Atif Aslam	Tere Bin	"Tere bin main yun kaise jiya
Kaise jiya tere bin
Tere bin main yun kaise jiya
Kaise jiya tere bin
Lekar yaad teri raaten meri kati
Lekar yaad teri raaten meri kati
Mujhse baaten teri karti hai chandni
Tanha hai tujh bin raaten meri
Din mere din ke jaise nahi
Tanha badan tanha hai ruh nam meri aankhen rahe
Aaja mere ab rubaru
Jeena nahi bin tere
Tere bin main yun kaise jiya
Kaise jiya tere bin
Tere bin main yun kaise jiya
Kaise jiya tere bin
Kab se aankhen meri raha mein tere bichhi
Kab se aankhen meri raha mein tere bichhi
Bhule se hi kabhi tu mil jaaye kahin
Bhule na mujhse baaten teri
Bheegi hai har pal aankhen meri
Kyun saans loon kyun main jiyu
Jeena bura sa lage
Kyun ho…"	"Without you, how did I live like this? 
How did I live without you? 
With your memories,my nights passed
The moonlight talks to me about you 
My nights are lonely with out you 
My days aren't like days 
Lonely body, lonely soul, my eyes stay wet 
Come to me now
I don't want to live without you 
Since when are my eyes layed in your path? 
(I wish)Atleast let us meet each other accidently
I can't forget your words 
My eyes are wet every second 
Why should I breath? Why should I live? 
Living feels bad
Why did you become unfaithful, tell me the reason 
"	2
Atif Aslam	Zindagi Aa rha Hoon Main	"Main sarphira musaafir
Hawaaon pe chalun
Yaaron ka main yaar hoon
Haan hans ke sab se milun

Inn khali khali jebon mein
Iraade behisaab hain
Inn chhoti chhoti aankhon mein
Bade bade se khwab hain

Sajaa de meri raahein tu
Khol de apni baahein tu

Aa raha hoon main
Zindagi aa raha hoon main
Kar le aa mujhse dosti
Zindagi aa raha hoon main (x2)

Dil ki suni hai maine toh
Dil ki hai main sununga
Paagal sa jiya hoon main
Paagal sa hi jeeyunga
Mujhe kya jeet haar se
Mujhe pyaar pyaar se
Hey…

Aa raha hoon main
Zindagi aa raha hoon main
Kar le aa mujhse dosti
Zindagi aa raha hoon main (x2)

(aa raha hoon main..)

Utha do aasmaano ko
Utha do aur bhi ooncha
Main apne pankh toh kholun
Mazaa toh aaye udne ka
Mujhme hausla bhara
Mujhe tu aazmaa zaraa

Aa raha hoon main
Zindagi aa raha hoon main
Kar le aa mujhse dosti
Zindagi aa raha hoon main (x2)"	"I am a crazy traveller,
I walk on the winds..
I am a friend of friends,
I meet everybody with a smile..
adorn my paths,
open your arms..
I am coming..
O life I am coming..
come, be friends with me..
O life, I am coming..
I have listened to my heart,
I will listen to my heart only..
I have lived like crazies,
I will live like crazy..
I don’t care for victory and loss,
I love love.
rise the skies,
rise the skies even higher..
I’ll spread my wings,
there will be fun of flying..
there is courage filled in me,
come, try me.."	1
Atif Aslam	O Saathi	"Allah Mujhe Dard Ke Kaabil Bana Diya
Toofaan Ko Hi Kashti Ka Saahil Bana Diya Bechainiyaa Sameyt Ke Saare Jahaan Ki Jab Kuchh Na Ban Saka Toh Mera Dil Banaa Diya
O Saathi Aa Bhi Jaa 
In Baahon Mein Ik Dafaa 
Toh Sukoon Ho Saanson Mein Be-Intehaa 
O Saathi Aa Bhi Jaa 
Kar De Bayaan Tu Bhi Zara 
Phir Tujhe Nigaaho Mein Main Rakh Loon Sadaa
Aankhein Moonde
Toh Jaane Kisse Dhoondey
Ke Soya Jaaye Na
Ke Soya Jaaye Na
Kisse Dhoondey
Ye Khwahishon Ke Boonde
Ke Soya Jaaye Na
Ke Soya Jaaye Na
Maano Nindiya Piroya Jaaye Na
Maano Nindiya Piroya Jaaye Na
Allah Mujhe Dard Ke Kaabil Bana Diya
Toofaan Ko…"	"O God, you made me
capable of bearing with pain.
you have made the storm itself
the shore of this boat (of mine).
collecting the restlessness 
of the whole world,
when nothing else could be made with it,
you made my heart.
O my companion, without you,
my shore is unclear.
when eyes are shut, 
I don't know whom they search for,
that I'm not able to sleep.
as if (pearl of) sleep can't be weaved (into a lace).
"	2
Atif Aslam	Chod Gaye Raste	"Chupke se aaye sabke darmiyaan
Sirf mein janu tu hai kahaan kahaan) - (2)
 
Hawa woh, sur woh, geet woh, aawaaz woh
Narami garami aahat ya saans woh
Kyun chhod gaye raste, kabhi saath chale the jinpe
 
Hawa woh, sur woh, geet woh, aawaaz woh
Narami garami aahat ya saans woh
Aahat sunu tumko dekhu, jab dekh lu kya main kahu
Honth khule jubaan kund ho, labjo ki khoj mein main gum rahu
Ho o o o o o...
Na na na na na.....
Kyun chhod gaye raste, kabhi saath chale the jinpe - (4)
Yeh ghadiyon ki saajish hai, ke aap aaye na
Yeh meri gujaarish, aaye toh jaane na"	"Very silently you came between everyone,
Only I'm aware wherever you are.(x2)
 
She's the wind, she's the tone, she's the song, she's the voice,
She is Softness, warmth, tune or breath .
Why did you leave the streets, once we walked on.
 
She's the wind, she's the tone, she's the song, she's the voice,
She is Softness, warmth, tune or breath.
I hear the tune, I see you, when I see you I'm speechless.
Lips get opened, tongue gets numb, I feel lost looking for words.
Ho o o o o o...
Na na na na na.....
Why did you leave the streets, once we walked on.(x4)
It is the conspiracy of the times that you don't come.
It is my wish that once you come, then never go away."	
