Singer	Title	Actual lyrics	text	
KK	Sajde	"sajde kiye hai lakhon, lakhon duayein maangi
 
paya hai maine phir tujhe
 
chaahat ki teri maine haq mein hawaaye maangi
 
paya hai maine phir tujhe
 
tujhse hi dil yeh behla, tu jaise kalma pehla
 
chahun na phir kyun main tujhe
 
jis pal na chaha tujhko, uss pal sazayein maangi
 
paya hai maine phir tujhe
 
sajde kiye hai lakhon, lakhon duayein maangi
paya hai maine phir tujhe
 
jaane tu sara woh, dil mein jo mere ho
 
padh le tu aake har dafa
 
nakhre se na ji bhi hote hain raazi bhi
tujhse hi hote hain khafa
 
jaane tu baatein saari katati hai raatein saari
 
jalate diye se an bujhe
 
uth uthake raaton ko bhi teri wafaayein maangi
 
paaya hai maine phir tujhe
 
chahat ke kaajal se, kismat ke kaagaz pe
 
apni wafayein likh zara
 
bole zamana yun, main tere jaisi hoon
 
tu bhi to mujhsa dikh zara
 
mera hi saaya tu hai, mujh mein samaya tu hai
 
har pal yeh lagta hai mujhe
 
khud ko mitaya maine, teri balayein maangi
 
paya hai maine phir tujhe
 
chahe tu chahe mujhko, aisi adaayein maangi
 
paya hai maine phir tujhe"	"In my prayers, numerous times, I've asked1
 
That is how I found you.
 
And I asked the winds to spread my need for you,
 
That is how I found you.
 
You made my heart wander, you are like a poet's first poem2
 
Then, why shouldn't I like you?
 
The moments when I forgot about you, I felt punished3
 
That is how I found you.
 
In my prayers, numerous times, I've asked,
That is how I found you.
 
You know it every time, whatsoever I might think,
 
You read my mind4 every time!
 
I tease you5 and then I'm wooed by you,
 
Yet I turn away from you.
 
You know all of it, about how I spend my nights,
 
Like a flame, unexhausted6
 
Even in the nights, I asked for your affection,
 
That is how I found you.
 
With the ink of you love, on the paper of my destiny,
 
Can you write your affection?7
 
And the world says I am like you,
 
Then why don't you look like me?8
 
I am your shadow, I am your part,
 
I feel you always.
 
I have taken up all what could harm you,
 
That is how I found you.
 
I prayed that you would like me too,
 
That is how I found you."	1
KK	Tu Jo Mila	"Aashiyaana mera saath tere hai na
Dhoondte teri gali mujhko ghar mila
Aab-o-daana mera haath tere hai na
Dhoondte tera Khuda mujhko Rab mila
Tu jo mila lo ho gaya main qaabil
Tu jo mila to ho gaya sab haasil haan!
Mushqil sahi aasaan hui manzil
Kyunki Tu.. Dhad.kan.. Main Dil…
 
Rooth jaana tera
Maan jaana mera
Dhoondhte teri hansi
Mill gayi khushi
Raah hoon main teri
Rooh hai tu meri
Dhoondhte tere nishaan
Mill gayi khudi
Tu jo mila lo ho gaya main qaabil
Tu jo mila to ho gaya sab haasil haan!
Mushqil sahi aasaan hui manzil
Kyunki Tu.. Dhadkan.. Main Dil…
O…
 
Tu jo mila lo ho gaya main qaabil
Tu jo mila to ho gaya sab haasil.. haan!
Tu jo mila aasaan hui mushqil
Kyunki Tu Dhadkan.. Main Dil…"	"My home is with you
Searching around in your street, I found your house
My seeds (bird food) are in your hands
While looking for your Creator, I found my God
When I found you, I became able (sane)
When I found you, I found everything
It wasn't that easy but now my destiny has become so easy for me to achieve
Because You .. are the heartbeat.. I'm the heart
 
You being mad at me
You making peace with me (again)
Looking for you smile
I found happiness
I'm your road
You're my soul
Looking for signs
I found my 'self'
When I found you, I became able (sane)
When I found you, I found everything
It wasn't that easy but now my destiny has become so easy for me to achieve
Because You .. are the heartbeat.. I'm the heart
O....
 
When I found you, I became able (sane)
When I found you, I found everything
When I found you, all my troubles went easy
Because You .. are the heartbeat.. I'm the heart"	4
KK	Yaaron	"Yaaro dosti badi hi hasin hai
Ye na ho to kya phir bolo ye zindagi hai

Koi to ho razdar
Begaraj tera ho yaar
Koi to ho razdar

Yaaro mohabbat hi to bandagi hai
Ye na ho to kya phir bolo ye zindagi hai

Koi to dilbar ho yaar
Jisko tujhse ho pyar
Koi to dilbar ho yaar

Teri har ek burai pe dante woh dost
Gam ki ho dhoop to saya bane tera woh dost

Nache bhi woh teri khushi mai
Are yaaro dosti badi hi haseen hai

Ye na ho to kya phir bolo ye zindagi hai
Koi to ho razdar
Begaraj tera ho yaar
Koi to ho razdar

Tan mann kare tujhpe fida mehboob woh
Palko pe jo rakhe tujhe mehboob woh
Jiski vafa tere liye ho

Are yaaro mohabbat hi to bandagi hai
Ye na ho to kya phir bolo ye zindgi hai
Koi to dilbar ho yaar
Jisko tujhse ho pyaar
Koi to dilbar ho yaar"	"My friends, friendship is a beautiful thing,
Without it, what is there to life?
We all need a secret-keeper, a faithful companion,
We all need a secret-keeper.
 
My friends, love is like finding something new,
Without it, what is there to life?
We all need a sweetheart, someone to love,
We all need a sweetheart.
 
Your friend is the one who scolds you when you do something wrong,
Your friend can make things better when grief weighs you down,
He's the one who dances when you're happy.
 
Oh! My friends, friendship is a beautiful thing,
Without it, what is there to life?
We all need a secret-keeper, a faithful companion,
We all need a secret-keeper.
 
Your love is the one who loses mind and body to you,
Your love is the one who lets you lay on her lap,
Whose fidelity is only to you.
 
Oh! My friends, love is like finding something new,
Without it, what is there to life?
We all need a sweetheart, someone to love,
We all need a sweetheart"	2
KK	Pyar ke pal	"Hum rahe ya na rahe kal
Kal yaad aayenge yeh pal
Pal, yeh hain pyaar ke pal
Chal, aa mere sang chal
Chal, soche kya
Chhoti si hai zindagi
Kal mil jaaye to hogi khushnaseebi
Hum rahe ya na rahe, yaad aayenge yeh pal) - 2
Shaam ka aanchal odhke aayi
Dekho voh raat suhaani
Aa likh de hum donon milke
Apni yeh prem kahaani
Hum rahe ya na rahe, yaad aayenge yeh pal
Aane waali subha jaane
Rang kya laaye deewaani
Meri chaahat ko rakh lena
Jaise koi nishaani
Hum rahe ya na rahe, yaad aayenge yeh pal
Hum…"	"Whether or not we are here tomorrow,
Tomorrow, we'll remember these moments,
These moments of love,
Come with me,
Come let's think about how short life is,
And how lucky we'll be if we can have tomorrow.
We'll remember these moment tomorrow whether we're here or not. ]x2
 
Breaking the spell of the evening,
See how the beautiful night has come,
Come let's write together
Our love story.
 
We'll remember these moment tomorrow whether we're here or not.
 
Who knows what the
Coming morning holds,
Keep my love with you,
Like a token of us.
 
We'll remember these moment tomorrow whether we're here or not.
 
Whether or not we are here tomorrow,
Tomorrow, we'll remember these moments,
These moments of love,
Come with me,
Come let's think about how short life is,
And how lucky we'll be if we can have tomorrow.
 
We'll remember these moment tomorrow whether we're here or not."	2
KK	Zara Sa	"Zara Si Dil Mein De Jagah Tu
Zara Sa Apna Le Bana
Zara Sa Khawbon Mein Saja Tu
Zara Sa Yaadhon Mein Basa
Mein Chahun Tujhko
Meri Jaan Bepanah
Fida Hoon Tujhpe
Meri Jaan Bepanah
Wooooo Hhhhooo Ooohhhh Hooo…
Zara Si Dil Mein De Jagah Tu
Zara Sa Apna Le Bana
Zara Sa Khawbon Mein Saja Tu
Zara Sa Yaadhon Mein Basa
Mein Chahun Tujhko
Meri Jaan Bepanah
Fida Hoon Tujhpe
Meri Jaan Bepanah
Wooooo Hhhhooo Ooohhhh Hooo…
Zara Si Dil Mein De Jagah Tu
Zara Sa Apna Le Bana
Zara Sa Khawbon Mein Saja Tu
Zara Sa Yaadhon Mein Basa
Mein Tere Mein Tere
Kadmoon Mein Rakh Du Yeh Jahan
Mera Ishq Deewangi
Ohhhhoo.
Hai Nahi Hai Nahi
Aashiq Koi Mujhsa Tera
Tu Mere Liye Bandagi
Mein Chahun Tujhko
Meri Jaan Bepanah
Fida Hoon Tujhpe
Meri Jaan Bepanah
Zara Si…"	"Give me some space in your heart
Make me yours a little bit
Decorate me a little bit in your dreams
Keep me a little bit in your memories
I love you
Beyond limits my love
I'm crazy about you
Beyond limits my love
Give me some space in your heart
Make me yours a little bit
Decorate me a little bit in your dreams
Keep me a little bit in your memories
I'll put
This world in your feet
My love is passionate
There is not
A lover like me of yours
You're a prayer for me
I love you
Beyond limits my love
I'm crazy about you
Beyond limits my love
Give me some space in your heart
Make me yours a little bit
Decorate me a little bit in your dreams
Keep me a little bit in your memories
Please tell
What's hidden in your heart
What are your wishes
Don't keep
Anything hidden from me my beloved
Have faith in me
I love you
Beyond limits my love
I'm crazy about you
Beyond limits my love"	1
KK	Alvida	"Chupke Se Kahin
Dheeme Paao Se
Jaane Kis Tarah
Kis Ghadi
Aage Badh Gaye
Humse Raahon Mein
Per Tum Toh abhi The Yahin
Kuch Bhi Na Suna
Kab Ka Tha Gila
Kaise Keh Diya Alvida
Jinke Darmiyan Guzri Thi Abhi
Kal Tak Yeh Meri Zindagi
Lo Unn Baahon Ko Thandhi Chao Ko
Hum bhi Kar Chale Alvida
Alvida Alvida
Meri Raahein Alvida
Meri Saansein Kehti Hai Alvida
Alvida Alvida Ab Kehna Aur Kya
Jab Tune Keh Diya Alvida
Sunle Bekhabar kyun Aankhein Pher Kar
Aaj Tu Chali Ja dhundegi Nazar
Humko Hi Magar Har Jagah
Aisi Raaton Mein
Lekar Karwate Yaad Humein Karna
Aur Phir Haarkar
Kehna Kyun Magar
Keh Diya
Alvida Alvida Koi Pochhe To Zara
Kya Socha Aur Kaha Alvida
Alvida Alvida Ab Kehna Aur Kya
Jab Tune Keh Diya Alvida
Hum The Diljale Phir Bhi Dil Kahe
Kash Mere Sang Aaj Hote Tum Agar
Hoti Har…"	"Quietly somewhere, with hushed footsteps, don't know where, or when
You moved ahead of me (i.e. left me behind), but you were just here
Didn't listen to anything, (how long were you upset), how could you say farewell?
Between whom my life had existed until yesterday...
To those arms, those cool shadows, I too say farewell
Farewell to my ways (my paths), my breath says farewell
Farewell, now what's left to say, when you've already said farewell
Listen, oh unconcerned one, you can leave today and turn your eyes away
But your gaze will search for me everywhere
During nights, when you turn sides [i.e. because you can't sleep] you will remember me
Then you'll know your mistake and ask yourself, why did I say farewell
Farewell, could someone ask her, what she thought when she said farewell
Farewell, now what's left to say, when you've already said farewell

I was happy-go-lucky, but yet my heart wishes (for you)
That if you were with me today, every path would have blossomed
I'm upset at you, I'm mad at you, my heart is confused
You didn't think clearly, you didn't listen to reason, why did you say farewell
Farewell, could someone ask her, what she thought when she said farewell
Farewell, now what's left to say, when you've already said farewell"	3
KK	Tadap Tadap ke	"Bejaan Dil Ko..Bejaan Dil Ko
Bejaan Dil Ko Tere Ishq Ne Zinda Kiya
Phir Tere Ishq Ne Hi Is Dil Ko Tabah Kiya
Tadap Tadapke Is Dil Se
Aah Nikalti Rahi
Mujhko Saza Di Pyaar Ki
Aisa Kya Gunaah Kiya
To Loot Gaye Haan Loot Gaye
To Loot Gaye Hum Teri Mohabbat Mein
Tadap Tadapke Is Dil Se
Aah Nikalti Rahi
Mujhko Saza Di Pyaar Ki
Aisa Kya Gunaah Kiya
To Loot Gaye Haan Loot Gaye
To Loot Gaye Hum Teri Mohabbat Mein
Tadap Tadapke Is Dil Se
Aah Nikalti Rahi
Mujhko Saza Di Pyaar Ki
Aisa Kya Gunaah Kiya
To Loot Gaye Haan Loot Gaye
To Loot Gaye Hum Teri Mohabbat Mein
Ajab Hai Ishq Yaara
Pal Do Pal Ki Khushiyaan
Gam Ke Khazaane Milte Hain Phir
Milti Hai Tanhaiyaan
Kabhi Aansoon Kabhi Aahein
Kabhi Shikve Kabhi Naalein
Tera Chehra Nazar Aaye
Tera Chehra Nazar Aaye
Mujhe Din…"	"This lifeless heart
This lifeless heart was awaken by Your love
And then this love of Yours also ruined this heart
Suffering, suffering, from inside this heart came out sighs
You gave me the punishment in love, what crime had I committed
That I have been robbed
That I have been robbed of everything in Your love
Suffering, suffering, from inside this heart came out sighs
You gave me the punishment in love, what crime had I committed
That I have been robbed
That I have been robbed of everything in Your love
Suffering, suffering, from inside this heart came out sighs
You gave me the punishment in love, what crime had I committed
That I have been robbed
That I have been robbed of everything in Your love
Suffering, suffering, from inside this heart came out sighs
You gave me the punishment in love, what crime had I committed
That I have been robbed
That I have been robbed of everything in Your love
This love is strange, my friend
Shaking, shaking, from inside this heart came out sighs
You gave me the punishment in love, what crime had I committed
That I have been robbed
That I have been robbed of everything in Your love
If I find God
Then I will ask him, Oh God!
Giving me the body of sand
Why did You make this heart of glass
And on top of this You gave it a nature
To fall in love
What glorious work of Yours, Oh Nature! (Sarcasm)
What glorious work of Yours, Oh Nature!, and on that You gave fate
Sometimes there is togetherness, sometimes there is separation
Sometimes there is togetherness, sometimes there is separation, this is what love is
What glorious work of Yours, Oh Nature!
Sobbing, sobbing, from inside this heart came out sighs
You gave me the punishment in love, what crime had I committed
That I have been robbed
That I have been robbed of everything in Your love
Suffering, suffering, from inside this heart came out sighs
You gave me the punishment in love, what crime had I committed
That I have been robbed of everything in Your love
"	3
KK	Labon ko	"Labon Ko Labon Pe Sajao
Kya Ho Tum Mujhe Ab Batao –2
Todh Do Khud Ko Tum
Banhon Mein Meri
Banhon Mein Meri
Banhon Mein Meri
Banhon Mein –2
Aaaaa.. Aaa..
Tere Ehsaasson Mein Bheege Lamhato Mein
Mujhko Dooba Tishnagi Si Hain
Teri Adao Se Dilkash Khatao Se
In Lamho Mein Zindagi Si Hai
Haya Ko Zara Bhool Jao
Mere Hi Tarah Pesh Aao
Ko Bhi Do Khud Ko Tum
Raaton Mein Meri
Raaton Mein Meri
Raaton Mein Meri
Raaton Mein
Aaaa, Aaa..
Labon Ko Labon Pe Sajao
Kya Ho Tum Mujhe Abb Batao –2
Tere Zajbaaton Mein Mehki Se Saason Mein
Yeh Jo Mehek Sandali Se Hai
Dil Ki…"	"Decorate your lips on my lips
Now tell me who are you
Decorate your lips on my lips
Now tell me who are you
Break yourself in my arms
Drown me in your emotions and in your drenched moments
Since I'm thirsty for love
Due to your grace and your beautiful mistakes
There's life in these moments
Forget about shyness
Be carefree just like me
Lose yourself in my nights
In my nights
In my nights
In my nights
Decorate your lips on my lips
Now tell me who are you
In your feelings and in your fragranced breaths
There's an aroma of sandalwood
In the shelter of your heart and in the spread sighs
I have a desire to go to sleep
Hide your face behind my face
Make me hear your heartbeats
Look at yourself in my eyes
In my eyes
In my eyes
In my eyes
Decorate your lips on my lips
Now tell me who are you"	1
KK	Kya mujhe pyar hai	"Kyun Aajkal Neend Kam Khwaab Jyada Hai
Lagta Khuda Ka Koi Nek Iraada Hain
Kal Ka Fakir Dil Aaj Shehzada Hain
Lagta Khuda Ka Koi Nek Iraada Hain
( Kya Mujhe Pyar Hain Ya
Kaisa Khumaar Hain Ya )… (2)
Pathhar Ke Inn Raston Pe
Phoolon Ki Ek Chadar Hain
Jabse Milen Ho Hamko
Badla Har Ek Manzar Hain
Dekho Jahaan Mein Neele Neele Aasmaan Tale
Rang Naye Naye Hain Jaise Ghulte Hue
Soye The Khwaab Mere Jaage Tere Waaste
Tere Khayaalon Me Hai Bheege Mere Raaste
( Kya Mujhe Pyar Hain Ya
Kaisa Khumaar Hain Ya )… (2)
Tum Kyon Chale Aate Ho
Har Roj In Khwaabon Mein
Chupke Se Aa Bhi Jao
Ek Din…"	"my world...
why is there more dream less sleep thesedays
it appears that God has some great plans
pauper of yesterday is prince of today
kya mujhe pyar hain aah 
am I in love?
what feeling is this?
on the roads paved with stone
there is covering of flowers
since when you met me
every scenario has changed
look in the world under blue sky
new colours are splashing around
my sleeping dreams woke for you
my paths are laden with your dreams
why do you come to me
every night in my dreams
come silently
one day in my arms
I dream of you day and night
there is some intoxication in your eyes
you are in my dreams, in my questions, in my answers
every day I steal and bring you in my thoughts"	1
KK	Guzzarish	"Tu Meri Adhuri Pyaas Pyaas, Tu Aa Gayi Mann Ko Raas Raas, Abb Toh
Tu Meri Adhuri Pyaas Pyaas, Tu Aa Gayi Mann Ko Raas Raas
Abb Toh Tu Aaja Paas Paas, Hai Guzaarish
Hain Haal To Dil Ka Tang Tang, Tu Rang Ja Mere Rang Rang
Bas Chalana Mere Sang Sang, Hai Guzaarish
Kehde Tu Haan Toh Jindagi, Chaano Se Chhutke Hasegi
Moti Honge Moti Raaho Mein Yeah Yeah Yeah
Tu Meri Adhuri Pyaas Pyaas, Tu Aa Gayi Mann Ko Raas Raas
Abb Toh Tu Aaja Paas Paas, Hai Guzaarish
Shishe Ke Khwaab Leke, Raato Mein Chal Raha Hu, 
Takara Naa Jaau Kahin
Aasha Ki Rahe Roshan, Phir Bhi Tufaa Kaa Darr Hain
Lau Bhuj Naa Jaye Kahin
Bas Ek Haa Ki Guzaarish, Phir Hogi Khushiyo Ki Baarish
Tu Meri Adhuri Pyaas Pyaas, Tu Aa Gayi Mann Ko…"	"You are my unquenched thirst, now my heart likes you
at least now come to me, this is a request..
The status of my heart is tight, now get colored in my hues
Just walk along with me, it's a request..
If you say yes, life will smile openly as if coming out of waterfalls,
there will be pearls in our paths..
Taking along dreams made of glass, I'm walking the nights,
I hope I don't collide somewhere..
the flame of hope is alighted, yet, I fear a storm..
I hope the flame doesn't get extinguished..
Just one request for your yes, then there will be a rain of joys..
There is the moon and the sky, and the clouds are dense,
I wish the moon doesn't get hidden..
This loneliness is pinching me, and heartbeat is rising,
There is no peace for a moment..
It's such a strange story, only restlessness is there.."	1
KK	Beetein Lamhe	"(Dard Mein Bhi Yeh Lab Muskura Jaate Hai
Beete Lamhein Hamein Jab Bhi Yaad Aate Hai) - 2
Beete Lamhein..........
(Chand Lamhaaat Ke Waaste Hi Sahi
Muskuraakar Mili Thi Mujhe Jindagi) -2
Teri Aaghosh Mein Din The Mere Kate
Teri Baahon Mein Thi Meri Raate Kati
Aaj Bhi Jab Woh Pal Mujhko Yaad Aate Hai
Dil Se Saare Gamon Ko Bhula Jaate Hai
(Dard Mein Bhi Yeh Lab Muskura Jaate Hai
Beete Lamhein Hamein Jab Bhi Yaad Aate Hai) - 2
Beete Lamhein..........
(Mere Kaandhe Pe Sir Ko Jhukaana Tera
Mere Sine Mein Khud Ko Chhupaana Tera) - 2
Aake Meri Panaahon Mein Shaamo…"	"My lips smile even in pain
Whenever I remember the moments that have gone by
My lips smile even in pain
Whenever I remember the moments that have gone by
The moments that have gone by
Even if it was for a few moments
But life met me with a smile
Even if it was for a few moments
But life met me with a smile
I spent my days in your lap
I spent my nights in your arms
Even today when I remember those moments
They make my heart forget all the grief
My lips smile even in pain
Whenever I remember the moments that have gone by
My lips smile even in pain
Whenever I remember the moments that have gone by
The moments that have gone by
You keeping your head on my shoulder
You hiding yourself in my chest
You keeping your head on my shoulder
You hiding yourself in my chest
You coming in my protection day and night
And you breaking up just like glass
Even today when I think about those sights
They erase all the loneliness in my heart
My lips smile even in pain
Whenever I remember the moments that have gone by
My lips smile even in pain
Whenever I remember the moments that have gone by
In pain ... the moments that have gone by
In pain ... the moments that have gone by"	2
KK	Sach Keh Raha Hai	"Sach keh raha hai deewana dil
Dil na kisi se lagana
Sach keh raha hai deewana dil
Dil na kisi se lagana
Jhoothe hai yaar ke vaade saare
Jhoothi hai pyar ki kasmein
Maine har lamha jise chaha, jise puja
Us hi ne yaaron mera dil toda toda
Tanha tanha chhoda
Sach keh raha hai deewana dil
Dil na kisi se lagana
Jhoothe hai yaar ke vaade saare
Jhoothi hai pyar ki kasmein
Maine har lamha jise chaha, jise puja
Us hi ne yaaron mera dil toda toda
Tanha tanha chhoda
Sundar sundar woh haseena badi
Sundar sundar main toh khone laga
Uske nashe mein bin peeye behaka
Sundar sundar woh haseena badi
Sundar sundar main toh khone laga
Uske nashe mein bin peeye behaka
Ek din usse bhula doonga main
Uske nishaan mita doonga main
Chahoonga na main us patthar ko
Ja usse bata de
O o ho sach keh raha hai deewana dil
Dil na kisi se lagana
Jhoothe hai yaar ke vaade saare
Jhoothi hai pyar ki kasmein
Maine har lamha jise chaha, jise puja
Us hi ne yaaron mera dil toda toda
Tanha tanha chhoda
Mausam mausam tha suhaana bada
Mausam mausam maine dekha usse
Hua main pagal bas pal bhar mein
Mausam mausam tha suhaana bada
Mausam mausam maine dekha usse
Hua main pagal bas pal bhar mein
Aake basi hai woh mere mann mein
Uski kami hai ab jeevan mein
Woh door hai meri nazron se
Kyun usse main chahoon
La lai lai lai lai la le
La lai lai lai lai la
La lai lai lai lai la le
La lai lai lai lai la
Maine har lamha jise chaha, jise puja
Us hi ne yaaron mera dil toda toda
Tanha tanha chhoda"	"My crazy heart is saying the truth
Don't fall in love with someone
My crazy heart is saying the truth
Don't fall in love with someone
The promises of the beloved are all lies
The promises of love are all lies
The one whom I loved and worshipped
That person broke my heart my friends
And left me alone
My crazy heart is saying the truth
Don't fall in love with someone
The promises of the beloved are all lies
The promises of love are all lies
The one whom I loved and worshipped
That person broke my heart my friends
And left me alone
She is a very beautiful lady
I started to lose myself in her beauty
I was intoxicated without even dinking
She is a very beautiful lady
I started to lose myself in her beauty
I was intoxicated without even dinking
One day I'll forget her
I'll erase all her symbols
I won't love that stone hearted person
Go and tell her that
O o ho my crazy heart is saying the truth
Don't fall in love with someone
The promises of the beloved are all lies
The promises of love are all lies
The one whom I loved and worshipped
That person broke my heart my friends
And left me alone
The weather was very beautiful
I saw her in that weather
I became crazy in just one moment
The weather was very beautiful
I saw her in that weather
I became crazy in just one moment
Now she is settled in my heart
Now she is missing in my life
She is far away from my eyes
Why do I love her
La lai lai lai lai la le
La lai lai lai lai la
La lai lai lai lai la le
La lai lai lai lai la
The one whom I loved and worshipped
That person broke my heart my friends
And left me alone
"	2
KK	Mera pehla pehla pyar	"Na Jaane Kab Yeh Hua Na Kisi Ko Khabar 
Na Khud Ko Pata Khoye Khoye Rehte Hum Yahan Hai
Silsilo Ka Silsila Hai Hua Shuru Abb Jo Nikle Bhi Jaan
Abb Se Humraahi Chahton Ke
Yeh Jaise Phela Nasha Woh Pheli Nazar Phela Khumaar
Yun Lage Mohabbat He Jahan Hai
Doston Ki Dosti Yaaron Ki Yaari Kam Lagne Lagi 
Behake Hai Hum Behaka Yeh Sama Hai
Kaise Samjhaau Tumjhe 
(Mera Phela Phela Pyaar Hai Yeh O O O..
Aankhon Mein Aitbaar Hai Yeh O O O..) - 2
Hawa Bhi Mili Thi Humein Jhokon Mein Puch Rahi…"	"Who knows when this happened
No one knows
I don't know
I stay lost
I am here
It is the story of love stories
It has started now if life passes
Now my desires
Are like the first intoxication
That first glance, that first intoxication
It feels that love is the world
The friendship of friends has started to feel little
I am absent-minded, absent-minded is the ambience
How can I make you understand
This is my first love
There is trust in the eyes) - 2
The breeze had met with me
It was asking me in gusts of wind
If this is not love then what is it
Oh sky, nowadays you are walking with me
The moon and stars are with me
How can I make you understand
This is my first love
There is trust in the eyes"	1
